{
  "analysis_layer": {
    "contract": null,
    "manifest_sha256": null,
    "state": "not_available"
  },
  "anchors": {
    "document_kind": "recording",
    "offset_reference": "code-point offsets, half-open, into the projection text of the token's turn",
    "offset_reference_state": "known",
    "producer_kinds": [
      "speaker_occurrence",
      "station_speaker"
    ],
    "source_included": false,
    "source_kind": "audio_master",
    "time_reference": "milliseconds on the timeline of the canonical audio of the recording",
    "time_reference_state": "known",
    "unit_kinds": [
      "turn",
      "contribution_unit"
    ]
  },
  "changes": {
    "added": [
      "expr1-000000000000000000000000000000a1",
      "expr1-000000000000000000000000000000b2"
    ],
    "removed": [],
    "replaced": []
  },
  "contract": "crosscorpus-release/v1",
  "corpus_id": "corapan",
  "coverage": {
    "records": 3,
    "schema": "crosscorpus-release-coverage/v1",
    "sha256": "fc719c5bee97f09a7d403be1809bca65f53600a4d36ee69eb6af5b012ad9ee4f"
  },
  "created_at": "2026-10-08T00:00:00Z",
  "date_semantics": "crosscorpus-date-semantics/v1",
  "documents": {
    "records": 3,
    "schema": "crosscorpus-release-document/v1",
    "sha256": "e3bfe77df9a7f6cc57803dc7f39fafa8de752a7282c9d777c1db66127e804d6a"
  },
  "fixture": true,
  "members": {
    "records": 2,
    "schema": "crosscorpus-release-member/v1",
    "sha256": "a67ce53b382179f2cc02db3bc76756b4d1718b6cd46705799668973af23686fa"
  },
  "modality": "spoken",
  "previous_release": {
    "release_id": null,
    "release_manifest_sha256": null,
    "state": "not_applicable"
  },
  "provenance": {
    "builder": {
      "commit": "0000000000000000000000000000000000000001",
      "repository": "corapan",
      "tool": "fixture-builder",
      "tool_version": "0"
    },
    "configuration": [
      {
        "id": "fixture-config",
        "sha256": "b0d4913f313bf0e18b6ec2d81d84ff748bdd415a26cb32243978b22b248567bc"
      }
    ],
    "member_code_commits": [
      "0000000000000000000000000000000000000001"
    ],
    "models": [
      {
        "id": "fixture-asr-model",
        "revision": null,
        "revision_state": "not_available",
        "role": "asr"
      }
    ],
    "pipeline": {
      "id": "corapan-pipeline",
      "versions": [
        "fixture-pipeline/0"
      ]
    },
    "stack": {
      "id": null,
      "sha256": null,
      "state": "not_available"
    }
  },
  "release_id": "corapan-0000-01",
  "release_kind": "fixture",
  "schema": "crosscorpus-release-manifest/v1",
  "selection_policy": {
    "id": null,
    "sha256": null,
    "state": "not_available"
  },
  "token_denominator": "crosscorpus-token-denominator/v1",
  "token_denominator_state": "known",
  "totals": {
    "audio_ms": 2820000,
    "audio_ms_state": "known",
    "documents": 3,
    "exports": 2,
    "tokens_counted": 39,
    "tokens_counted_state": "known"
  },
  "vocabularies": {
    "date_basis": [
      "BROADCAST_DATE",
      "PUBLICATION_DATE"
    ],
    "export_schema": [
      "corapan-export-ready/v1"
    ]
  }
}
